priority,package,affected_item_count,disapproved_item_count_estimate,issue_group_count,fix_surface,safe_next_action,approval_required_for_write,write_allowed_now
P0,P0_admin_url_checkout_landing_review,37,37,3,Merchant account / checkout URL / PDP availability,verify checkout/PDP URL samples in browser/admin and prepare exact admin fix preview; no URL/feed write now,Merchant/Shopify admin change or feed URL rule change,False
P1,P1_required_attributes_feed_mapping,827,548,8,Shopify product data or feed mapping for required attributes,"create attribute template by product type: age_group, gender, color, size, material/pattern where applicable; preview exact mapping only",Shopify product/metafield update or Merchant feed rule/supplemental feed update,False
P1,P1_gtin_identifier_compliance_review,14,0,1,Identifier policy / GTIN / identifier_exists mapping,"prepare SKU-level identifier compliance list; decide whether GTIN is valid, blank, or identifier_exists=false before feed write",Shopify metafield/feed identifier mapping update,False
P1,P1_local_inventory_program_review,1,1,1,Local inventory feed / local surfaces configuration,review whether LK wants LocalSurfaces active and reconcile local inventory feed mapping before any change,Merchant local inventory feed/config update,False
P2,P2_price_sync_monitor,75,0,3,Merchant price crawl freshness / Shopify price sync,monitor unless persistent with disapproval; compare sample PDP price vs Merchant after next crawl,price/feed change only if persistent mismatch is verified,False
P2,P2_other_feed_issue_review,3,0,2,Other Merchant issue,review issue details and sample products before proposing any write,depends on issue; no write allowed from this preview,False
